{"insufficientSupportOutcome":"insufficient-support","labelVocabulary":"mavi-vehicle-subclass-labels-v1","minimumSupport":{"evaluablePerClass":30,"evaluableTotal":30},"operational":{"coverageOverEvaluable":{"minimum":null},"perClass":{"bus":{"precision":{"minimum":null},"recall":{"minimum":null}},"car":{"precision":{"minimum":null},"recall":{"minimum":null}},"motorcycle":{"precision":{"minimum":null},"recall":{"minimum":null}},"truck":{"precision":{"minimum":null},"recall":{"minimum":null}}}},"schemaVersion":"vehicle-subclass-requirements-v1"}